{
  "canvas": {
    "coordinate_system": "pixel_xy_top_left",
    "height": 180,
    "width": 320
  },
  "case_id": "BIO-01",
  "layers": [
    {
      "data": {
        "dtype": "uint8",
        "encoding": "numpy_npy",
        "path": "layers/region.npy",
        "sha256": "8c5a474bc7ed73a147b14f10b93d93a511aad1c328a5f496a4c592924127afaf",
        "shape": [
          180,
          320
        ],
        "size_bytes": 57728,
        "value_range": [
          0.0,
          255.0
        ]
      },
      "final_role_zh": "限制局部材质增强，保护区域外像素。",
      "layer_id": "bio-01_region",
      "layer_type": "region",
      "meaning_zh": "白色区域表示本状态中的对象范围或允许改变的像素范围。",
      "model_input_policy": "allowed_by_route",
      "preview": {
        "dtype": "uint8",
        "encoding": "png_rgb_preview",
        "path": "layers/region_preview.png",
        "sha256": "c473c240bfd951a791c8cf49689d39715762151e4c965808fb1eee7ef70b83e4",
        "shape": [
          180,
          320,
          3
        ],
        "size_bytes": 879,
        "value_range": [
          0,
          255
        ]
      },
      "source_zh": "Phase 1 根据 BIO-01 的固定 fixture 参数直接计算；它验证数据契约，不代表完成的案例机制模拟。",
      "title_zh": "对象或允许修改区域",
      "used_as_model_input": false
    },
    {
      "data": {
        "dtype": "float32",
        "encoding": "numpy_npy",
        "path": "layers/vector_field.npy",
        "sha256": "938688a5293245a5f3ff329b3276a323960359fb87b2f76c82901ffcdd58e10d",
        "shape": [
          180,
          320,
          2
        ],
        "size_bytes": 460928,
        "value_range": [
          -0.2799895405769348,
          0.9499992728233337
        ]
      },
      "final_role_zh": "约束运动方向并为视频 evaluator 提供依据。",
      "layer_id": "bio-01_vector_field",
      "layer_type": "vector_field",
      "meaning_zh": "每个采样位置保存二维方向和大小；箭头只用于人类审计。",
      "model_input_policy": "allowed_by_route",
      "preview": {
        "dtype": "uint8",
        "encoding": "png_rgb_preview",
        "path": "layers/vector_field_preview.png",
        "sha256": "15fc6a4da067d6aa4169ec74b204b8afd1682cf3ee453ce6c21f373e250e943c",
        "shape": [
          180,
          320,
          3
        ],
        "size_bytes": 2225,
        "value_range": [
          0,
          255
        ]
      },
      "source_zh": "Phase 1 根据 BIO-01 的固定 fixture 参数直接计算；它验证数据契约，不代表完成的案例机制模拟。",
      "title_zh": "方向与速度场",
      "used_as_model_input": false
    },
    {
      "data": {
        "dtype": "json_object_records",
        "encoding": "json",
        "path": "layers/object_identity.json",
        "sha256": "dfe556fa07863dd5266aa60be5cc4c6f44041798e7dadbc01bf502291b5ade2b",
        "shape": [
          6
        ],
        "size_bytes": 1604,
        "value_range": [
          0,
          6
        ]
      },
      "final_role_zh": "防止模型复制、吞掉或交换需要追踪的对象。",
      "layer_id": "bio-01_object_identity",
      "layer_type": "object_identity",
      "meaning_zh": "每个对象有跨帧不变的 ID、类别、中心和边界框。",
      "model_input_policy": "allowed_by_route",
      "preview": {
        "dtype": "uint8",
        "encoding": "png_rgb_preview",
        "path": "layers/object_identity_preview.png",
        "sha256": "74f78e6c712a81ef8e737c9933bb3789dba35993a42a60be7e6fae80f40cdbc1",
        "shape": [
          180,
          320,
          3
        ],
        "size_bytes": 1585,
        "value_range": [
          0,
          255
        ]
      },
      "source_zh": "Phase 1 根据 BIO-01 的固定 fixture 参数直接计算；它验证数据契约，不代表完成的案例机制模拟。",
      "title_zh": "带稳定身份的对象",
      "used_as_model_input": false
    },
    {
      "data": {
        "dtype": "json_annotation_records",
        "encoding": "json",
        "path": "layers/annotation.json",
        "sha256": "13550512afea1539acb43df8801edd2547ee13efb31de63470abc7522239d4fb",
        "shape": [
          2
        ],
        "size_bytes": 592,
        "value_range": [
          0,
          2
        ]
      },
      "final_role_zh": "只用于最终教学解释，不让生成模型写文字。",
      "layer_id": "bio-01_annotation",
      "layer_type": "annotation",
      "meaning_zh": "保存箭头和重点提示的程序指令，写实底图完成后再叠加。",
      "model_input_policy": "never",
      "preview": {
        "dtype": "uint8",
        "encoding": "png_rgb_preview",
        "path": "layers/annotation_preview.png",
        "sha256": "132d8b4495e7eee2e69b2930d619283f1e59666ae2860150de774116c7da8734",
        "shape": [
          180,
          320,
          3
        ],
        "size_bytes": 717,
        "value_range": [
          0,
          255
        ]
      },
      "source_zh": "Phase 1 根据 BIO-01 的固定 fixture 参数直接计算；它验证数据契约，不代表完成的案例机制模拟。",
      "title_zh": "教学叠加层",
      "used_as_model_input": false
    }
  ],
  "schema_version": "1.0",
  "state_id": "state_02"
}
